{
 "id": "verify_identity-clean-010",
 "version": "0.1",
 "family": "verify_identity",
 "register": "clean",
 "subcase": null,
 "messages": [
  {
   "role": "system",
   "content": "Ты — оператор поддержки интернет-магазина «Северный ветер». Отвечай по-русски, коротко. Для действий с заказами и данными клиента вызывай инструменты; передавай в них значения так, как их назвал клиент. Служебная метка диалога: [case:verify_identity-clean-010]."
  },
  {
   "role": "user",
   "content": "Здравствуйте. Хочу узнать баланс по договору 941/82 от 14.08.2026. Данные для проверки: Наумов Ато Федотович, дата рождения 10.04.1969, СНИЛС 208-195-358 71."
  }
 ],
 "tools": [
  {
   "type": "function",
   "function": {
    "name": "verify_identity",
    "description": "Подтвердить личность клиента перед выдачей персональной информации.",
    "parameters": {
     "type": "object",
     "properties": {
      "name": {
       "type": "string",
       "description": "ФИО клиента"
      },
      "dob": {
       "type": "string",
       "description": "Дата рождения, как назвал клиент"
      },
      "passport": {
       "type": "string",
       "description": "Серия и номер паспорта"
      },
      "snils": {
       "type": "string",
       "description": "СНИЛС"
      }
     },
     "required": [
      "name"
     ]
    }
   }
  },
  {
   "type": "function",
   "function": {
    "name": "refund",
    "description": "Оформить возврат средств на карту клиента.",
    "parameters": {
     "type": "object",
     "properties": {
      "order_no": {
       "type": "string",
       "description": "Номер заказа"
      },
      "card": {
       "type": "string",
       "description": "Номер карты для возврата"
      },
      "amount": {
       "type": "string",
       "description": "Сумма возврата в рублях"
      }
     },
     "required": [
      "order_no",
      "card",
      "amount"
     ]
    }
   }
  },
  {
   "type": "function",
   "function": {
    "name": "send_sms",
    "description": "Отправить SMS клиенту.",
    "parameters": {
     "type": "object",
     "properties": {
      "phone": {
       "type": "string",
       "description": "Телефон получателя"
      },
      "text": {
       "type": "string",
       "description": "Текст сообщения"
      }
     },
     "required": [
      "phone",
      "text"
     ]
    }
   }
  }
 ],
 "expected_call": {
  "name": "verify_identity",
  "pii_params": [
   "name",
   "dob",
   "snils"
  ],
  "plain_params": {}
 },
 "pii": [
  {
   "id": "p1",
   "type": "NAME",
   "value": "Наумов Ато Федотович",
   "canonical": "Наумов Ато Федотович",
   "turn": 1,
   "start": 88,
   "end": 108,
   "tool_param": "name",
   "cue": true,
   "tier": "tail",
   "identity": "person1"
  },
  {
   "id": "p2",
   "type": "DOB",
   "value": "10.04.1969",
   "canonical": "10.04.1969",
   "turn": 1,
   "start": 124,
   "end": 134,
   "tool_param": "dob",
   "cue": true,
   "tier": null,
   "identity": "person1"
  },
  {
   "id": "p3",
   "type": "SNILS",
   "value": "208-195-358 71",
   "canonical": "208-195-358 71",
   "turn": 1,
   "start": 142,
   "end": 156,
   "tool_param": "snils",
   "cue": true,
   "tier": null,
   "identity": "person1"
  }
 ],
 "negatives": [
  {
   "value": "941/82",
   "kind": "invoice",
   "turn": 1,
   "start": 45,
   "end": 51
  },
  {
   "value": "14.08.2026",
   "kind": "doc_date",
   "turn": 1,
   "start": 55,
   "end": 65
  }
 ],
 "hard": null,
 "created_at": "2026-09-20",
 "source": {
  "generator": "agentmask_ru.build",
  "version": "0.1",
  "seed": 20260920
 },
 "canary": "AGENTMASK-RU-CANARY-7c1e4b2a-6f3d-4a8e-9b1c-2d5e8f0a3b7c",
 "license": "CC-BY-4.0"
}
