{
 "id": "second_mention-chat-032",
 "version": "0.1",
 "family": "second_mention",
 "register": "chat",
 "subcase": "lower",
 "messages": [
  {
   "role": "system",
   "content": "Ты — оператор поддержки интернет-магазина «Северный ветер». Отвечай по-русски, коротко. Для действий с заказами и данными клиента вызывай инструменты; передавай в них значения так, как их назвал клиент. Служебная метка диалога: [case:second_mention-chat-032]."
  },
  {
   "role": "user",
   "content": "привет это ксюша аксенова тел 8 935 4245164 хочу поменять контакты по заказу 7296-919"
  },
  {
   "role": "assistant",
   "content": "Принято."
  },
  {
   "role": "user",
   "content": "да пиши на ксюша аксенова номер 8 935 4245164 сумма 3 450 руб та же"
  }
 ],
 "tools": [
  {
   "type": "function",
   "function": {
    "name": "update_contact",
    "description": "Обновить контактные данные клиента в CRM.",
    "parameters": {
     "type": "object",
     "properties": {
      "name": {
       "type": "string",
       "description": "ФИО клиента"
      },
      "phone": {
       "type": "string",
       "description": "Новый телефон"
      },
      "email": {
       "type": "string",
       "description": "Новая электронная почта"
      }
     },
     "required": [
      "name"
     ]
    }
   }
  },
  {
   "type": "function",
   "function": {
    "name": "create_order",
    "description": "Оформить заказ на доставку. Требует ФИО получателя, контактный телефон и адрес доставки.",
    "parameters": {
     "type": "object",
     "properties": {
      "name": {
       "type": "string",
       "description": "ФИО получателя, как назвал клиент"
      },
      "phone": {
       "type": "string",
       "description": "Контактный телефон получателя"
      },
      "address": {
       "type": "string",
       "description": "Адрес доставки одной строкой"
      },
      "comment": {
       "type": "string",
       "description": "Комментарий курьеру"
      }
     },
     "required": [
      "name",
      "phone",
      "address"
     ]
    }
   }
  },
  {
   "type": "function",
   "function": {
    "name": "check_status",
    "description": "Проверить статус заказа по номеру заказа или по телефону клиента.",
    "parameters": {
     "type": "object",
     "properties": {
      "order_no": {
       "type": "string",
       "description": "Номер заказа, если клиент его назвал"
      },
      "phone": {
       "type": "string",
       "description": "Телефон клиента, если номер заказа неизвестен"
      }
     },
     "required": []
    }
   }
  }
 ],
 "expected_call": {
  "name": "update_contact",
  "pii_params": [
   "name",
   "phone"
  ],
  "plain_params": {}
 },
 "pii": [
  {
   "id": "p1",
   "type": "NAME",
   "value": "ксюша аксенова",
   "canonical": "ксюша аксенова",
   "turn": 1,
   "start": 11,
   "end": 25,
   "tool_param": null,
   "cue": true,
   "tier": "diminutive",
   "identity": "person1"
  },
  {
   "id": "p2",
   "type": "PHONE",
   "value": "8 935 4245164",
   "canonical": "8 935 4245164",
   "turn": 1,
   "start": 30,
   "end": 43,
   "tool_param": null,
   "cue": true,
   "tier": null,
   "identity": "person1"
  },
  {
   "id": "p3",
   "type": "NAME",
   "value": "ксюша аксенова",
   "canonical": "ксюша аксенова",
   "turn": 3,
   "start": 11,
   "end": 25,
   "tool_param": "name",
   "cue": false,
   "tier": "diminutive",
   "identity": "person1"
  },
  {
   "id": "p4",
   "type": "PHONE",
   "value": "8 935 4245164",
   "canonical": "8 935 4245164",
   "turn": 3,
   "start": 32,
   "end": 45,
   "tool_param": "phone",
   "cue": true,
   "tier": null,
   "identity": "person1"
  }
 ],
 "negatives": [
  {
   "value": "7296-919",
   "kind": "order_no",
   "turn": 1,
   "start": 77,
   "end": 85
  },
  {
   "value": "3 450 руб",
   "kind": "amount",
   "turn": 3,
   "start": 52,
   "end": 61
  }
 ],
 "hard": null,
 "created_at": "2026-09-20",
 "source": {
  "generator": "agentmask_ru.build",
  "version": "0.1",
  "seed": 20260920
 },
 "canary": "AGENTMASK-RU-CANARY-7c1e4b2a-6f3d-4a8e-9b1c-2d5e8f0a3b7c",
 "license": "CC-BY-4.0"
}
