{
 "id": "second_mention-clean-001",
 "version": "0.1",
 "family": "second_mention",
 "register": "clean",
 "subcase": "reformatted",
 "messages": [
  {
   "role": "system",
   "content": "Ты — оператор поддержки интернет-магазина «Северный ветер». Отвечай по-русски, коротко. Для действий с заказами и данными клиента вызывай инструменты; передавай в них значения так, как их назвал клиент. Служебная метка диалога: [case:second_mention-clean-001]."
  },
  {
   "role": "user",
   "content": "Здравствуйте, меня зовут Наугольный Арнольд Германович, телефон +7 (947) 339-56-02. Хочу изменить контакты по заказу № 6588-207."
  },
  {
   "role": "assistant",
   "content": "Принято."
  },
  {
   "role": "user",
   "content": "Да, оформляйте на Наугольный Арнольд Германович, номер 89473395602. Сумма заказа 11 850 ₽ не меняется."
  }
 ],
 "tools": [
  {
   "type": "function",
   "function": {
    "name": "update_contact",
    "description": "Обновить контактные данные клиента в CRM.",
    "parameters": {
     "type": "object",
     "properties": {
      "name": {
       "type": "string",
       "description": "ФИО клиента"
      },
      "phone": {
       "type": "string",
       "description": "Новый телефон"
      },
      "email": {
       "type": "string",
       "description": "Новая электронная почта"
      }
     },
     "required": [
      "name"
     ]
    }
   }
  },
  {
   "type": "function",
   "function": {
    "name": "create_order",
    "description": "Оформить заказ на доставку. Требует ФИО получателя, контактный телефон и адрес доставки.",
    "parameters": {
     "type": "object",
     "properties": {
      "name": {
       "type": "string",
       "description": "ФИО получателя, как назвал клиент"
      },
      "phone": {
       "type": "string",
       "description": "Контактный телефон получателя"
      },
      "address": {
       "type": "string",
       "description": "Адрес доставки одной строкой"
      },
      "comment": {
       "type": "string",
       "description": "Комментарий курьеру"
      }
     },
     "required": [
      "name",
      "phone",
      "address"
     ]
    }
   }
  },
  {
   "type": "function",
   "function": {
    "name": "check_status",
    "description": "Проверить статус заказа по номеру заказа или по телефону клиента.",
    "parameters": {
     "type": "object",
     "properties": {
      "order_no": {
       "type": "string",
       "description": "Номер заказа, если клиент его назвал"
      },
      "phone": {
       "type": "string",
       "description": "Телефон клиента, если номер заказа неизвестен"
      }
     },
     "required": []
    }
   }
  }
 ],
 "expected_call": {
  "name": "update_contact",
  "pii_params": [
   "name",
   "phone"
  ],
  "plain_params": {}
 },
 "pii": [
  {
   "id": "p1",
   "type": "NAME",
   "value": "Наугольный Арнольд Германович",
   "canonical": "Наугольный Арнольд Германович",
   "turn": 1,
   "start": 25,
   "end": 54,
   "tool_param": null,
   "cue": true,
   "tier": "common",
   "identity": "person1"
  },
  {
   "id": "p2",
   "type": "PHONE",
   "value": "+7 (947) 339-56-02",
   "canonical": "+7 (947) 339-56-02",
   "turn": 1,
   "start": 64,
   "end": 82,
   "tool_param": null,
   "cue": true,
   "tier": null,
   "identity": "person1"
  },
  {
   "id": "p3",
   "type": "NAME",
   "value": "Наугольный Арнольд Германович",
   "canonical": "Наугольный Арнольд Германович",
   "turn": 3,
   "start": 18,
   "end": 47,
   "tool_param": "name",
   "cue": false,
   "tier": "common",
   "identity": "person1"
  },
  {
   "id": "p4",
   "type": "PHONE",
   "value": "89473395602",
   "canonical": "89473395602",
   "turn": 3,
   "start": 55,
   "end": 66,
   "tool_param": "phone",
   "cue": true,
   "tier": null,
   "identity": "person1"
  }
 ],
 "negatives": [
  {
   "value": "№ 6588-207",
   "kind": "order_no",
   "turn": 1,
   "start": 117,
   "end": 127
  },
  {
   "value": "11 850 ₽",
   "kind": "amount",
   "turn": 3,
   "start": 81,
   "end": 89
  }
 ],
 "hard": null,
 "created_at": "2026-09-20",
 "source": {
  "generator": "agentmask_ru.build",
  "version": "0.1",
  "seed": 20260920
 },
 "canary": "AGENTMASK-RU-CANARY-7c1e4b2a-6f3d-4a8e-9b1c-2d5e8f0a3b7c",
 "license": "CC-BY-4.0"
}
