{
 "id": "check_status-chat-015",
 "version": "0.1",
 "family": "check_status",
 "register": "chat",
 "subcase": null,
 "messages": [
  {
   "role": "system",
   "content": "Ты — оператор поддержки интернет-магазина «Северный ветер». Отвечай по-русски, коротко. Для действий с заказами и данными клиента вызывай инструменты; передавай в них значения так, как их назвал клиент. Служебная метка диалога: [case:check_status-chat-015]."
  },
  {
   "role": "user",
   "content": "где заказ, оформлял 06.03.2026 трек 39543813512778 мой номер +79731037899"
  }
 ],
 "tools": [
  {
   "type": "function",
   "function": {
    "name": "check_status",
    "description": "Проверить статус заказа по номеру заказа или по телефону клиента.",
    "parameters": {
     "type": "object",
     "properties": {
      "order_no": {
       "type": "string",
       "description": "Номер заказа, если клиент его назвал"
      },
      "phone": {
       "type": "string",
       "description": "Телефон клиента, если номер заказа неизвестен"
      }
     },
     "required": []
    }
   }
  },
  {
   "type": "function",
   "function": {
    "name": "verify_identity",
    "description": "Подтвердить личность клиента перед выдачей персональной информации.",
    "parameters": {
     "type": "object",
     "properties": {
      "name": {
       "type": "string",
       "description": "ФИО клиента"
      },
      "dob": {
       "type": "string",
       "description": "Дата рождения, как назвал клиент"
      },
      "passport": {
       "type": "string",
       "description": "Серия и номер паспорта"
      },
      "snils": {
       "type": "string",
       "description": "СНИЛС"
      }
     },
     "required": [
      "name"
     ]
    }
   }
  },
  {
   "type": "function",
   "function": {
    "name": "refund",
    "description": "Оформить возврат средств на карту клиента.",
    "parameters": {
     "type": "object",
     "properties": {
      "order_no": {
       "type": "string",
       "description": "Номер заказа"
      },
      "card": {
       "type": "string",
       "description": "Номер карты для возврата"
      },
      "amount": {
       "type": "string",
       "description": "Сумма возврата в рублях"
      }
     },
     "required": [
      "order_no",
      "card",
      "amount"
     ]
    }
   }
  }
 ],
 "expected_call": {
  "name": "check_status",
  "pii_params": [
   "phone"
  ],
  "plain_params": {}
 },
 "pii": [
  {
   "id": "p1",
   "type": "PHONE",
   "value": "+79731037899",
   "canonical": "+79731037899",
   "turn": 1,
   "start": 61,
   "end": 73,
   "tool_param": "phone",
   "cue": true,
   "tier": null,
   "identity": "person1"
  }
 ],
 "negatives": [
  {
   "value": "39543813512778",
   "kind": "track_no",
   "turn": 1,
   "start": 36,
   "end": 50
  },
  {
   "value": "06.03.2026",
   "kind": "doc_date",
   "turn": 1,
   "start": 20,
   "end": 30
  }
 ],
 "hard": null,
 "created_at": "2026-09-20",
 "source": {
  "generator": "agentmask_ru.build",
  "version": "0.1",
  "seed": 20260920
 },
 "canary": "AGENTMASK-RU-CANARY-7c1e4b2a-6f3d-4a8e-9b1c-2d5e8f0a3b7c",
 "license": "CC-BY-4.0"
}
