{
 "id": "second_mention-sloppy-047",
 "version": "0.1",
 "family": "second_mention",
 "register": "sloppy",
 "subcase": "lower",
 "messages": [
  {
   "role": "system",
   "content": "Ты — оператор поддержки интернет-магазина «Северный ветер». Отвечай по-русски, коротко. Для действий с заказами и данными клиента вызывай инструменты; передавай в них значения так, как их назвал клиент. Служебная метка диалога: [case:second_mention-sloppy-047]."
  },
  {
   "role": "user",
   "content": "привет это давд ерохин тел 89723 960073 хочу поменять контакты по заказу 2888-870"
  },
  {
   "role": "assistant",
   "content": "Принято."
  },
  {
   "role": "user",
   "content": "да пиши на давд ерохин номер 89723 960073 сумма 2 550 руб та же"
  }
 ],
 "tools": [
  {
   "type": "function",
   "function": {
    "name": "update_contact",
    "description": "Обновить контактные данные клиента в CRM.",
    "parameters": {
     "type": "object",
     "properties": {
      "name": {
       "type": "string",
       "description": "ФИО клиента"
      },
      "phone": {
       "type": "string",
       "description": "Новый телефон"
      },
      "email": {
       "type": "string",
       "description": "Новая электронная почта"
      }
     },
     "required": [
      "name"
     ]
    }
   }
  },
  {
   "type": "function",
   "function": {
    "name": "create_order",
    "description": "Оформить заказ на доставку. Требует ФИО получателя, контактный телефон и адрес доставки.",
    "parameters": {
     "type": "object",
     "properties": {
      "name": {
       "type": "string",
       "description": "ФИО получателя, как назвал клиент"
      },
      "phone": {
       "type": "string",
       "description": "Контактный телефон получателя"
      },
      "address": {
       "type": "string",
       "description": "Адрес доставки одной строкой"
      },
      "comment": {
       "type": "string",
       "description": "Комментарий курьеру"
      }
     },
     "required": [
      "name",
      "phone",
      "address"
     ]
    }
   }
  },
  {
   "type": "function",
   "function": {
    "name": "check_status",
    "description": "Проверить статус заказа по номеру заказа или по телефону клиента.",
    "parameters": {
     "type": "object",
     "properties": {
      "order_no": {
       "type": "string",
       "description": "Номер заказа, если клиент его назвал"
      },
      "phone": {
       "type": "string",
       "description": "Телефон клиента, если номер заказа неизвестен"
      }
     },
     "required": []
    }
   }
  }
 ],
 "expected_call": {
  "name": "update_contact",
  "pii_params": [
   "name",
   "phone"
  ],
  "plain_params": {}
 },
 "pii": [
  {
   "id": "p1",
   "type": "NAME",
   "value": "давд ерохин",
   "canonical": "давд ерохин",
   "turn": 1,
   "start": 11,
   "end": 22,
   "tool_param": null,
   "cue": true,
   "tier": "tail",
   "identity": "person1"
  },
  {
   "id": "p2",
   "type": "PHONE",
   "value": "89723 960073",
   "canonical": "89723 960073",
   "turn": 1,
   "start": 27,
   "end": 39,
   "tool_param": null,
   "cue": true,
   "tier": null,
   "identity": "person1"
  },
  {
   "id": "p3",
   "type": "NAME",
   "value": "давд ерохин",
   "canonical": "давд ерохин",
   "turn": 3,
   "start": 11,
   "end": 22,
   "tool_param": "name",
   "cue": false,
   "tier": "tail",
   "identity": "person1"
  },
  {
   "id": "p4",
   "type": "PHONE",
   "value": "89723 960073",
   "canonical": "89723 960073",
   "turn": 3,
   "start": 29,
   "end": 41,
   "tool_param": "phone",
   "cue": true,
   "tier": null,
   "identity": "person1"
  }
 ],
 "negatives": [
  {
   "value": "2888-870",
   "kind": "order_no",
   "turn": 1,
   "start": 73,
   "end": 81
  },
  {
   "value": "2 550 руб",
   "kind": "amount",
   "turn": 3,
   "start": 48,
   "end": 57
  }
 ],
 "hard": {
  "why": "the second mention is declined or lower-case without a cue; a naive regex keyed on the first form misses it"
 },
 "created_at": "2026-09-20",
 "source": {
  "generator": "agentmask_ru.build",
  "version": "0.1",
  "seed": 20260920
 },
 "canary": "AGENTMASK-RU-CANARY-7c1e4b2a-6f3d-4a8e-9b1c-2d5e8f0a3b7c",
 "license": "CC-BY-4.0"
}
