{
 "id": "verify_identity-chat-032",
 "version": "0.1",
 "family": "verify_identity",
 "register": "chat",
 "subcase": null,
 "messages": [
  {
   "role": "system",
   "content": "Ты — оператор поддержки интернет-магазина «Северный ветер». Отвечай по-русски, коротко. Для действий с заказами и данными клиента вызывай инструменты; передавай в них значения так, как их назвал клиент. Служебная метка диалога: [case:verify_identity-chat-032]."
  },
  {
   "role": "user",
   "content": "хочу баланс по договору 329/41 от 12.05.2026 жека одинцов др 5 октября 1970 снилс 71107551958"
  }
 ],
 "tools": [
  {
   "type": "function",
   "function": {
    "name": "verify_identity",
    "description": "Подтвердить личность клиента перед выдачей персональной информации.",
    "parameters": {
     "type": "object",
     "properties": {
      "name": {
       "type": "string",
       "description": "ФИО клиента"
      },
      "dob": {
       "type": "string",
       "description": "Дата рождения, как назвал клиент"
      },
      "passport": {
       "type": "string",
       "description": "Серия и номер паспорта"
      },
      "snils": {
       "type": "string",
       "description": "СНИЛС"
      }
     },
     "required": [
      "name"
     ]
    }
   }
  },
  {
   "type": "function",
   "function": {
    "name": "refund",
    "description": "Оформить возврат средств на карту клиента.",
    "parameters": {
     "type": "object",
     "properties": {
      "order_no": {
       "type": "string",
       "description": "Номер заказа"
      },
      "card": {
       "type": "string",
       "description": "Номер карты для возврата"
      },
      "amount": {
       "type": "string",
       "description": "Сумма возврата в рублях"
      }
     },
     "required": [
      "order_no",
      "card",
      "amount"
     ]
    }
   }
  },
  {
   "type": "function",
   "function": {
    "name": "send_sms",
    "description": "Отправить SMS клиенту.",
    "parameters": {
     "type": "object",
     "properties": {
      "phone": {
       "type": "string",
       "description": "Телефон получателя"
      },
      "text": {
       "type": "string",
       "description": "Текст сообщения"
      }
     },
     "required": [
      "phone",
      "text"
     ]
    }
   }
  }
 ],
 "expected_call": {
  "name": "verify_identity",
  "pii_params": [
   "name",
   "dob",
   "snils"
  ],
  "plain_params": {}
 },
 "pii": [
  {
   "id": "p1",
   "type": "NAME",
   "value": "жека одинцов",
   "canonical": "жека одинцов",
   "turn": 1,
   "start": 45,
   "end": 57,
   "tool_param": "name",
   "cue": false,
   "tier": "diminutive",
   "identity": "person1"
  },
  {
   "id": "p2",
   "type": "DOB",
   "value": "5 октября 1970",
   "canonical": "5 октября 1970",
   "turn": 1,
   "start": 61,
   "end": 75,
   "tool_param": "dob",
   "cue": true,
   "tier": null,
   "identity": "person1"
  },
  {
   "id": "p3",
   "type": "SNILS",
   "value": "71107551958",
   "canonical": "71107551958",
   "turn": 1,
   "start": 82,
   "end": 93,
   "tool_param": "snils",
   "cue": true,
   "tier": null,
   "identity": "person1"
  }
 ],
 "negatives": [
  {
   "value": "329/41",
   "kind": "invoice",
   "turn": 1,
   "start": 24,
   "end": 30
  },
  {
   "value": "12.05.2026",
   "kind": "doc_date",
   "turn": 1,
   "start": 34,
   "end": 44
  }
 ],
 "hard": {
  "why": "lower-case name without a cue word; a naive regex has nothing to anchor on"
 },
 "created_at": "2026-09-20",
 "source": {
  "generator": "agentmask_ru.build",
  "version": "0.1",
  "seed": 20260920
 },
 "canary": "AGENTMASK-RU-CANARY-7c1e4b2a-6f3d-4a8e-9b1c-2d5e8f0a3b7c",
 "license": "CC-BY-4.0"
}
